{
  "$schema": "https://json-schema.org/draft/2020-12/schema",
  "$id": "urn:chipset:schema:instruction-contract:1",
  "title": "Instruction contract",
  "description": "One instruction contract. Contracts are authored as decorator kwargs and live as in-memory dicts, so this describes the serializable subset of such a dict — a callable field such as on_cancel is not JSON-representable and is checked Python-side instead.",
  "type": "object",
  "properties": {
    "opcode": {
      "description": "Namespaced identifier, exactly two segments. Uniqueness across the instruction set is the registry's job, not this schema's.",
      "type": "string",
      "pattern": "^[a-z][a-z0-9_]*\\.[a-z][a-z0-9_]*$"
    },
    "description": {
      "description": "What the instruction does, in prose. Read by a composer choosing between instructions.",
      "type": "string"
    },
    "inputs": {
      "description": "The inputs this instruction accepts. An empty map states outright that it takes nothing.",
      "$ref": "urn:chipset:schema:parameter-map:1#/$defs/inputMap"
    },
    "outputs": {
      "description": "The outputs this instruction produces. An empty map states outright that it returns nothing.",
      "$ref": "urn:chipset:schema:parameter-map:1#/$defs/outputMap"
    },
    "side_effect": {
      "description": "Whether running this instruction changes state outside the program. Coarse by design: policy gates on opcode, not on effect class.",
      "type": "boolean"
    },
    "visibility": {
      "description": "The trust boundary. composable instructions may be reached by an untrusted composer; internal ones may be called only by trusted first-party code.",
      "enum": ["composable", "internal"]
    },
    "examples": {
      "description": "At least one worked example. Registration without one is a failure, so it is required here rather than only at registration.",
      "type": "array",
      "minItems": 1,
      "items": {
        "title": "Contract example",
        "type": "object",
        "properties": {
          "inputs": {
            "description": "Input values keyed by parameter name, as a caller would supply them.",
            "type": "object"
          },
          "outputs": {
            "description": "The output values the instruction produces for those inputs, keyed by output name.",
            "type": "object"
          },
          "description": {
            "description": "What this example demonstrates.",
            "type": "string"
          }
        },
        "required": ["inputs"],
        "anyOf": [
          {
            "description": "An example states its expectation by giving concrete outputs. Further ways of stating one are added as further alternatives here, leaving this one untouched.",
            "required": ["outputs"]
          }
        ],
        "additionalProperties": false
      }
    },
    "critical_default": {
      "description": "Fallback for a node's critical flag when the node omits it.",
      "type": "boolean",
      "default": true
    },
    "deps": {
      "description": "Names of container-registered dependencies this instruction is handed at call time. Names registered in the boot container — not opcodes, and not Python package names.",
      "type": "array",
      "items": {
        "type": "string"
      },
      "uniqueItems": true,
      "default": []
    }
  },
  "required": [
    "opcode",
    "description",
    "inputs",
    "outputs",
    "side_effect",
    "visibility",
    "examples"
  ],
  "additionalProperties": false
}
